Relazione sulla gestione Bilancio consolidato,Bilancio di Esercizio,io Deliberz,,
Transizione verso un'economia circolare Attività 4.9 Il Gruppo presenta un piano per la gestione dei rifiuti che aarantisce il massimo riutilizzo 0 riciclaaaio al ter-,"Protezione e ripristino della biodiversità e degli ecosistemi Le attività 4.9, 4.15, 6.15, 6.17 presentano il criterio",sono previsti esplicitamente nei capitolati d'ap - palto l'accettazione del Codice Etico nei contratti con i fornitori e limpegno dei fornitori ad applica - re le linee auida nei rapporti con altri subfornitori;,"Competizione leale ADR, che opera in un mercatc mentato e non concorrenzial",le iercato particol enziale; svolge
che garantisce il massimo riutilizzo riciclaggio al ter- mine del ciclo di vita conformemente alla gerarchia dei rifiuti che garantisce conformità con il criterio DNSH: Attività 5.5 Nel processo di raccolta e aestioni di rifiutiauesti,"Le attivita 4.9, 4.15, 6.15, 6.1( presentano ll criterlo DNSH che fa riferimento all'Appendice D; pertanto è stata svolta un'analisi di verifica trasversale. Si fac - cia riferimento a quanto riportato nel criterio relativo all'uso sostenibile e protezione delle acque delle risorse marine sopra presentato",re le linee guida nei rapporti con altri subfornitori; è stata promulgata nel corso del 2022 una speci - fica Policy sui Diritti Umani che mira ad aumen - tare la consapevolezza e garantire il rispetto dei diritti umani nell'ambito della sfera del Gruppo,mentato e non concorrenzial in modo conforme a tutte le concorrenza leale e richiede salvaguardia della concorre pendenti. Inoltre; la procedur incentiva laa incentivare la li,enzlale; svolge tte le leggi vige hiede il rispettc ncorrenza da p cedura di sele re la libera con
sono raccolti in maniera differenziata e non sono mischiati negli impianti di stoccaggio e trasferimen - to con altri rifiuti 0 materiali con proprietà diverse; in linea con le richieste del relativo criterio Attività 6.15 e 6.17 Poiché le attività 6.15 e 6.17 non prevedono la presenza di rifiuti da costruzione e demolizione; il criterio DNSH,"Inoltre; per l'attività 6.15 sono stati verificati piani per i servizi di manutenzione della vegetazione e per il di - serbo stradale; che prevedono misure di gestione delle specie invasive e la salvaguardia di eventuale fauna selvatica sui siti, che rispettano quanto dichiarato dalla seconda parte del criterio.","ADR e della sua catena del valore A tal fine si intende integrare un modello di due diligence che permetta di identificare; prevenire; mitigare e affrontare gli impatti negativi sui diritti umani in maniera più puntuale. Allinterno di questo quadro; si rammenta che sul sito wwwadrit è presente il canale ""ADR Group Whistleblowing"" che indirizza alla piattaforma dedicata di raccolta segnalazioni","Infine si segnala che ADR no per violazione del diritto del ni, corruzione e tassazione alcun caso trattato da un Na dell'OCSE, né è stato interro Human Rights Resource Cen",DR non è stato to del lavoro 0 ione e non è st un National C nterrogato dal e Center (BHRF
"po ADR per la trasmissione e distribuzione di energia elettrica presenta esclusivamente linee sottoterra, il criterio risulta non applicabile. Inoltre, non essendo utilizzati policlorobifenili; il criterio si ritiene verificato_ Attività 4.15 Parte dell'impiantistica accessoria utilizzata dal Grup- po risulta essere antecedente; in termini di installazio - ne; al periodo di applicazione della direttiva 2009/125/ CE al netto degli impianti di cogenerazione base. Duranteilnrocacco diacauicto vione tenutain conci","La a Uella PiJIa ConpaiiCe opecco relativi a diritti umani e diritti dei lavoratori, corru - zione; tassazione e concorrenza leale; è da intendersi come applicabile a tutte le attività economiche di ADR. L'analisi è stata condotta considerando l'ade- guatezza dei processi del Gruppo nell'identificare e prevenire possibili impatti negativi sulle quattro aree considerando anche l'eventuale efficacia di azioni di mitigazione: Rispetto dei diritti umani (inclusi i diritti dei lavo-",Anticorruzione Il Gruppo ha adottato politiche; sistemi di gestione; misu- re e programmi per garantire l'etica e la conformità nella lotta alla corruzione; con riferimento principale alla Policy Anticorruzione; al Sistema di Gestione per la prevenzione della corruzione secondo lo standard internazionale ISO 37001.2016 e al Codice Etico. Per maggiori informazioni si rimanda alla sezione 4.4 Etica e Compliance per quanto concernela nectioneinterna della tematica @alla cezione,unipersonale; ADR Iel S.p.A Unipersonale; ADR Mobility Security S.r.l Unipersonale- Unipersonale; Fiumicino Ene Poichè la disclosure 2021 ha zione semplificata inerente ammissibili (come previsto d che peraltro non includeva l'5 OpEx; non saranno presental allineamento con il periodo,l S.pA; ADR AS obility S.rL U onale; Airport 10 Energia S.rL 21 ha previsto rente la sola qu isto dal Regola deva l'indicator sentati dati co riodo preceden
Duiaile [ piucessu Ul aCquslu Vlene Cenula [iCUilol derazione la presenza di migliori tecnologie disponibili sul mercato per tutti i nuovi impianti. A valle delle con-,ratori) In linea con i Principi relativi ai Diritti Umani del Global,CufiCCFic [a Yeallunic [iiccnia Uclla Cehiallud alla -clluic 5.9.3 Supply Chain per la verifica dei criteri anticorruzione verso i fornitori.,disponibili.,
"conforme alle richieste e che le scelte per nuove tec - nologie siano allineate a quanto richiesto dal criterio. Attività 6.15 e 6.17. Per le attività relative al settore dei trasporti; vengono adottate misure per la mitigazione di rumore e vibra - zioni, se necessario. Inoltre; essendo adottate anche misure per la riduzione del rumore, delle vibrazioni e delle polveri durante lavori di manutenzione il crite-","impegna a promuovere e rispettare i diritti umani e ad assicurarsi di non essere complice in eventuali abusi. ADR considera il rispetto delle garanzie minime di sal- vaguardia sulla base dell'applicazione del Codice Etico, delle Policy Anticorruzione e di altri processi in essere in tutta la propria catena del valore. Nello specifico:","Tassazlone Il Gruppo ADR; che aderisce ad un regime di adempimento collaborativo; svolge le proprie attività aziendali in manie - ra conforme alle leggi ed ai regolamenti in materia fiscale; aderendo al regime fiscale di adempimento collaborativo. La Strategia Fiscale del Gruppo ADR; approvata nel 2019, definisce gli obiettivi ed i principi adottati nella gestione della fiscalità ed è finalizzato all'implementazione di un",Il turnover ammissibile/alline calcolato come la parte del f da prodotti e servizi associat ammissibililallineate alla tas divisa per il fatturato netto ( al 31.12.2022. dati sono stati Profit & Loss Statement di G in conformità allo IAS 182la),/allineato alla e del fatturato sociati alle att lla tassonomia etto (denomin 0 stati elaborai Jt di Gruppo co 1 82la)
UcllC PulvCiluui aiicc aVUiulnaucenieunci UilcC rio si ritiene verificato.,il Codice Etico riconosce come imprescindibile il rispetto delle tematiche connesse alla so - stenibilità ed ai diritti umani sia da parte delle,sistema di controllo interno del rischio fiscale (Tax Control Framework) che sia pienamente rispondente agli stan - dard internazionali; condivisi in seno all'OCSE e fatti propri,CuIulTlca alu IAo kocia) Il numeratore del KPI turnove netti associati alle attività d,Iocia. urnover è cost ività del Grupp-
