"formazioni dai responsabili delle funzioni e, a tale riguardo; non abbiamo osservazioni particolari da riferire."
bbiamo acquisito conoscenza e vigilato; per quanto di nostra competenza; sull'adeguatezza e sul funzionamento
el sistema amministrativo-contabile; nonché sull'affidabilità di quest'ultimo a rappresentare correttamente i
itti di aestione mediante l'ottenimento di informazioni dai responsabili delle funzioni e dal sogaetto incarica -
della revisione legale dei conti e l'esame dei documenti aziendali e a tale riquardo non abbiamo osservazioni
articolari da riferire.
on sono pervenute denunzie ex art. 2408 c.c
el corso del 2022 il Collegio in ossequio all'art. 2389 c.c. ha espresso il proprio parere in ordine alla determina -
9 9 3 4u C9P PieP Pu one del comnenso snettante al Presidente del CDA nominato dall'Assemblea dei Sociin data 28 anrile 2022 ed
N € 3P UN WAmministratore Deleaato
el corso dell'attività di viailanza come sopra descritta non sono emersi altri fatti sianificativi tali da richiedere
enzione nella presente relazione.
lodici della Crisi d'impresa e dell'insolvenza
"stato eseguito il monitoraggio periodico ai fini della valutazione di eventuali sintomi di disagio economico,"
499 F 49 nanziario 0 natrimoniale tali da rilevare una situazione diinsofferenza da seanalare all'oraano amministrativo ai
ensi e per gli effetti di cui all'art. 15 del D.L 118/2021.
onclusioni
"ignori Azionisti,"
hche in considerazione delle risultanze dell'attività svolta dall'organo di controllo contabile contenute nell'ap -
psita relazione di revisione del Bilancio; il Collegio propone all'Assemblea di approvare il Bilancio chiuso al 31
icembre 2022 così come redatto dagli Amministratori. Il Collegio concorda circa la proposta di portare a nuovo
utile dell'esercizio a euro 30.740.510. pari
er il Collegio Sindacale
Presidente
lott. Giuseppe Cosimo Tolone
