ttera agli keholder,
[l'anno in cui le attività aeroportuali hanno recuperato in modo rilevante; avvicinandosi ai volumi Iltraffico è risultato; soprattutto nella seconda frazione dell'esercizio; in forte incremento rispetto al così il superamento delle incertezze sulle prospettive di sviluppo e sulle progettualità che avevano gli anni pesantemente impattati dalla crisi del settore per effetto dalle limitazioni imposte ai viaggi in fegioni del mondo.,"Dopo le operazioni finanziarie messe in campo nel corso del 2021, nel 2022 la struttura finanziaria di ADR ha visto un'ulteriore evoluzione verso obiettivi di solidità e sostenibilità; unitamente al miglioramento dei rating creditizi. A tal proposito si segnala la nuova linea di credito revolving da 350 milioni di euro; anch'essa nell'innovativo for- mato sustainability-linked e con durata 5 anni (estendibili fino a 7) sottoscritta a ottobre 2022 in sostituzione del precedente contratto da 250 milioni di euro (in scadenza nel 2023)."
"ha chiuso l'anno a circa 33 milioni di passeggeri; è fortemente cresciuto rispetto al 2021 (+134,7%) nponenti extra europee ed europee (+262,8% e 138,0%). Nell'arco dell'anno il recupero dei flussi di petto al 2019 risulta pari al 66,5%, combinazione di un inizio anno ancora gravemente impattato ella pandemia e un periodo finale che ha segnato un recupero di oltre ['80%. lanno; è proseguito l'impegno del Gruppo, come nel 2021, per dotare il sistema aeroportuale romano Fecnologie e sistemi innovativi al fine di garantire standard di sicurezza e di qualità all'avanguardia. liunti confermano il costante impegno di tutto il personale di Aeroporti di Roma che ha consentito 6cin cio ~i +- +; Iio +orna7ian9 a Gc","Gli investimenti sono ammontati a oltre 214 milioni di euro; in aumento del 21% rispetto al 2021, per l'ampliamento e il potenziamento del sistema aeroportuale romano. In particolare; gli investimenti realizzati nel corso dell'anno hanno incluso i lavori della nuova area d'imbarco A al Terminal 1 destinata ai voli Schengen e domestici e inaugu - rata il 18 maggio alla presenza; tra gli altri; del Presidente della Repubblica; Sergio Mattarella: L'infrastruttura; di circa 37.000 mq, testimonianza dell'eccellenza italiana da un punto di vista ingegneristico e architettonico; è stata completata impiegando con massima efficienza il sedime aeroportuale (senza consumo di suolo aggiuntivo) e realizzata facendo ricorso alle migliori competenze del Paese. Si tratta di un'opera all'avanguardia per soluzioni innovative e di tutela ambientale che potrà ospitare presso lo scalo di Fiumicino ulteriori 6 milioni di passeggeri"
"cino (""""ACI Europe Best Airport Award"" 2022 nella categoria degli hub con oltre 40 milioni di passeg - Ita negli ultimi 5 anni che ADR si posiziona al primo posto in Europa; a seguito della valutazione di sperti dell'industria Travel in Europa. Questo risultato si aggiunge al riconoscimento del 'Leonar- e per 5 anni consecutivi risulta in testa alla classifica europea sulla qualità del servizio espressa","Sono stati, inoltre avviati i lavori di riqualificazione dell'area di imbarco A31-A52 (ex Molo B) proseguiti in gene - rale lavori e progettazioni degli investimenti essenziali per la sicurezza; la continuità operativa e l'adempimento aaliobbliahinormativi"
"he per 5 anni consecutivi risulta in testa alla classifica europea sulla qualità del servizio espressa Ndai passeggeri, attraverso la survey internazionale condotta da ACI World in oltre 300 aeroporti in Grazie a questi risultati, nel 2022 ACI ha incluso ADR nel ""Director General's Roll of Excellence""",agli obblighi normativi. Il processo di trasformazione intrapreso da ADR; con particolare attenzione a Sostenibilità e Innovazione; non si è intorrotto nao cfafoultoriormonfo accolorato rafforzando:nilactridalla cfrafocia di Grun
nza di cui fanno parte solo 64 aeroporti in tutto il mondo (su oltre 18.000 scali presenti in tutto il sono contraddistinti per gli elevatissimi livelli di qualità nei servizi. Anche Skytrax; l'organizzazione utazione di compagnie aree e aeroporti; ha premiato lo scalo di Fiumicino con il Best Airport Staff l'efficienza del personale addetto all'assistenza al cliente e l'UNWTO; l'Organizzazione Mondiale del lla prima volta in assoluto ha premiato l'hub della Capitale con un riconoscimento ufficiale sulla Fraffico aereo ha interessato in particolare il mercato europeo e nord-americano. Le performance,"incerToclo ma € Slalo ulcerormente accelerato, rarrorzanao ( pllastrt aella slralegla al oruppo. Sostenibilità e Innovazione rimangono i driver centrali della strategia di sviluppo di ADR; pienamente integrati nel business del Gruppo. Il Piano di Sostenibilità è costituito da un insieme strutturato di obiettivi e programmi; organizzato su tre aree di intervento prioritarie: Persone; Ambiente e Sviluppo. Riduzione del consumo di energia; impianti fotovoltaici; decarbonizzazione; intermodalità sostenibile; open innovation sono principali ambiti di impegno della roadmap di ADR per accompagnare il percorso di transizione energetica e digitale. Un crescente impegno verso un modello di business responsabile assicurato anche dal supporto ai Dieci Principi del Global Comnact delle Nazioni UInite nelle aree dei Diritti Umani avoro Amhiente Anticorruzione"
"2022 hanno complessivamente superato anche le più ottimistiche aspettative di ripresa formulate Fte dell'anno e che erano ancora condizionate dall'andamento assai negativo del primo trimestre per crisi pandemica Nel corso del 2022, infatti, lo sviluppo Aviation di Fiumicino ha visto l'ingresso sullo huove compagnie aeree e l'attivazione di circa 50 nuove rotte; di cui 19 verso nuove destinazioni pre - non operate. Tra le diverse novità vale la pena ricordare; l'avvio dei voli tra Roma e Perth (primo colle - to tra ('Europa Continentale e lAustralia) le nuove rotte di WestJet per Calgary (primo collegamento lia ed il Central-West Canada) di Gulf Air per Bahrein e tutte le nuove rotte lanciate sul Breve-Medio Air, Ryanair; Volotea; Icelandair e Transavia. ude con un risultato operativo consolidato positivo per 131,9 milioni di euro (-45,9 milioni di euro","Aeroporti di Roma; con l'obiettivo di proiettare il sistema aeroportuale verso una visione innovativa; si è fatta pro - motrice di una serie di accordi strategici; coinvolgendo principali player nazionali; come Enel, Eni, Terna; Hera Gruppo Ferrovie dello Stato; Leonardo; PwC; per favorire la transizione degli scali della Capitale a smart hub ener - getici; innovativi e sostenibili. In questa logica; riveste una grande rilevanza strategica anche l'intesa con le Fer- rovie dello Stato sullo sviluppo dell'intermodalità attraverso il potenziamento dei servizi di connessione diretta di Alta Velocità con lo scalo di Fiumicino e lo sviluppo di prodotti integrati ""treno+aereo"" Inoltre; nell'ottica della decarbonizzazione dell'intero settore; ADR ha avviato un piano di installazione di una rete di colonnine di ricarica elettrica per la mobilità aeroportuale (circa 500 colonnine entro il 2025), che diverrà nel tempo sempre più pulita."
