"3,42","3,40","3,43","3,31","3,74 3,73","3,73","4,07",,,,
2010,2011,2012,2013,2014 2015,2015,2016 2017 2018 2019,2017,2019,2022,
Contrc,llo della,qualità,dei servi:,sugli spazi,zi,secondo livello; di cui 4 verific,econdo livell,4 verific,iche re,attività
ILiaiiu lo degld passa,LaineilC ispazi su per quant,Uel PIuC o-concess 0 concerr,"Ea9uul si, in ottic ne il siste",~llune € CUIICiu 1 di Sostenibilit 1a di migliorame,"iliUL bilità, ramento","Al N iieUl Sllitiulai € Cuinpui LaI da parte dei sub-concessionar ""Vademecum ambientale"" all'i",Tiie Ul aluii a parte dei su lademecum,"MIpUI LaI essionar ale"" all'i","i/Nell ari, ADR linterne",VI Luual ato un 2 sono ri -
"placlal zione tablet, ogni nc",oIMIla (nI dei contrc la gestio pn-confo,)Imlallca lli ispetti ne delle mità risc,"Cne Cons ivi, l'utiliz contromis ontrata",Nle la programn 0 di check-list Jre generate pe i sopralluoghi.,Tammnla- list su e per ghi.,Cusloinei expenence Mensilmente risultati dei Mys con Retailer per individuare relative alle visite che hanno,Isloinei exp ensilmente pn Retailer lative alle vi,dei Mys iduare hanno,ystery eventus ricevut,ondivise correttive zio neaa -
In rifer corso degli s,"imento del 2022, pazi sub",lle temat sono sta concessi,iche amb te effettu 18 verifi,"entali, invece, ate, nell'ambito he approfondit","nel bito ndite di ice,",tivo. Insieme ai risultati della riceve anche il ranking dell'anc stery di tutti i punti vendita de,vo. Insieme ceve anche ery di tutti,-i della dell'anc ndita de,singola damen della ga,Retailer isite merciale. My-
