'ey ACI World Airport cellente),ld Airport Service Quality: Ins,verall Sa-,action 2010-202,C0)35 Scala di valutazione: da,La qualità del servizio passa anche attraverso il moni - toraggio del rispetto degli SLA contrattuali. In ambito food & beverage sono stati inseriti quattro parametri:,completamente ristrut adeguata al layout dei tando il numero di bane
"4,40","4,44",tempo di attesa cassa; tempo di attesa banco; tempo di sbarazzo banco; tempo di sbarazzo tavolo.,è iniziata la sostituzion controllo sicurezza con consentono di non rim dispositivi digitali e liq confortevole il process,,,
"3,43 3,31 2012 2013","3,74 3,73 3,31 2013 2014 2015",16,2018,2020 2021 2022,"5.8.2 Le iniziative In linea con gli anni passati e tenuto conto delle nuove esigenze derivanti dall'emergenza sanitaria; anche nel 2022 ADR si è impegnata nell'individuazione di azioni volte sia al miglioramento dell'esperienza del passeg - gero su entrambi gli scali romani; resi sempre più inno - vativi e sicuri, sia al mantenimento di elevati livelli di aualità; con strutture e servizi sempre più innovativi,",nella sala bagagli del mancanza dei nastri in turazione; è stato aper mentre nella sala TI pr ne che porteranno nel di tre nastri aggiuntivi nuovo ingresso alla sal dono via cobus; ulteriore novità nell'are
)-Conicessu [n1 OlLlCa 0 concerne il sistema,"[n OLLlCa Ul buslenlolllld, e il sistema di miglioramen","Ga pal Le ""Vadem",El su0-Cunicess um ambientale,aru ADRnla elauoralo Unl Llinterno del quale sono ri -,Interventi infrastrutturali,Servizi al passeggero e inf
imato di ispezioni) ici controlli anche in petti condivisi con Health & Safety ha,pezioni). Inoltre; vengono li anche in riferimento a ten livisi con la funzione aziend afety ha effettuato 206 isp,2022 il contrat Per qua percepi Retail,"lemecum ambi n essere ed ai concerne; inve dal passeggero B, questa viene",ale è stato esteso anche ai vi contratti F&B e Retail. la qualità del servizio 'interno dei punti vendita isurata attraverso visite,nell'area Airside; a maggio 2022 sono state aper- te nuove aree che consentono la ridistribuzione del flusso dei passeggeri tra Schengen ed Ex - tra-Schengen; che negli ultimi due anni aveva se - guito mutamenti dovuti allo scenario imposto dal,"family situate in continuità sedute differenziate al Mole VC del TI, aree work dotate comfort al nuovo Molo A e In entrambi Terminal nelle incoriki"
"ro delle subconcess no gestite attravers rmatica che consen lli ispettivi, l'utilizzo 1e delle contromisun mità riscontrata nei","ubconcessioni commercial e attraverso l'ausilio di una he consente la programma i, l'utilizzo di check-list su ntromisure generate per ntrata nei sopralluoghi.",periodic Client custom Mensiln con Re ,effettuate att giudicano tutt experience. te risultati d iler per individu n,erso società di Mystery aspetti che influenzano la lystery vengono condivise eventuali azioni correttive,"Covla-19. In parcicolare, sono stacl rest operactvl il Nuovo Molo A, una nuova area dimbarchi di 16 mila metri quadrati con 13 nuovi loading bridge e 10 nuovi gate remoti; corredati di segnaletica dinamica e statica in caso di spegnimento per tematiche leaate alla sostenibilità-",S0110 Slall lnisenLl Gel puncl hanno aumentato il numerc giungersi alle sedute elettr di ultima apertura (piazza T nuovo Molo A). Sono stati in rini per soddisfare le richies
"le tematiche ambie sono state effettua concessi, 18 verifich","che ambientali, invece, ne effettuate, nell'ambito 18 verifiche approfondite",ICaClC tivo. Ins riceve stery dZ,vlalC ne ai risultati he il ranking de tti i punti vendi,C 477 9hulllunieya a singola visita; il Retailer ndamento delle visite My - della galleria commerciale.,la nuova area di controllo passaporti per i pas - seggeri in transito; che consente di ristabilire la gestione dei voli Schengen nell'area Est ed Extra-Schengen nell'area Ovest; lampliamento dell'area riservata ai controlli pas- saporti in partenza;,biente e fornire un servizio punti ristoro sono attualme Nel processo di migliorame de è stata inoltre completa preghiera multireligiosa pre luci dai colori caldi è statc bilente dinreabiara_accoali
lampliamento dell'area riservata ai controlli pas - saporti in partenza;,luci dai colori caldi è statc hianto dinronhiara accoali,,,,,
