I costi relativi all’energia elettrica recepiscono la rettifica positiva delle maggiori accise versate nel periodo 1/1/2011-,FORZA MEDIA,2022,Unnamed: 0,2021,Variazione
"31/05/2012 per 958 mila euro, a seguito della conclusione favorevole del contenzioso avviato da Leonardo Energia per",Dirigenti,"51,7",,"49,3","2,4"
ottenere la restituzione dei maggiori importi pagati. Il rimborso spettante a favore di Leonardo Energia sarà interamen-,Quadri,"245,5",,"241,4","4,1"
"te riversato in favore di ADR, quale soggetto a suo tempo inciso indebitamente dell’accisa, unitamente agli interessi.",Impiegati,"709,9",,"676,4","33,5"
,Operai,"309,5",,"307,7","1,8"
6.3 Costi per servizi,TOTALE FORZA MEDIA,"1.316,6",,"1.274,8","41,8"
