(migliaia di euro),N20O2T2E,Unnamed: 0,2021,Unnamed: 1,(migliaia di euro).1,N20O2T2E.1,Unnamed: 2,2021.1,Unnamed: 3
Contributi e sovvenzioni,,1.115,,220.035,Costi per manutenzioni,,53.168,,41.604
Plusvalenze da alienazioni,,131.0,,107.0,Costi per rinnovo infrastrutture aeroportuali,,38.473,,43.65
Recuperi di spesa,,11.939,,4.955,Costi per servizi esterni,,10.648,,16.6
Indennizzi da terzi,,189.0,,207.0,Costi per servizi di costruzione,,117.222,,88.632
Altri proventi,,6.645,,6.542,Pulizie e disinfestazioni,,6.628,,5.614
TOTALE ALTRI RICAVI OPERATIVI,,20.019,,231.846,,,,,
