0,1,2,3
"ESG
Evoluzione quadro
normativo","Rischi derivanti da mutamenti del
quadro normativo di riferimento a
livello nazionale e/o internazionale","Danni patrimoniali ed economici po-
tenzialmente dovuti, ad esempio alla
revisione del sistema tariffario e/o ai
maggiori costi per adeguamento alle
evoluzioni del contesto di riferimento","I. monitoraggio del contesto regola-
torio e normativo a livello nazionale
ed internazionale
II. attività di benchmarking giuridico/
economico e valutazione quantitativa
di eventuali modifiche alla dinamica
tariffaria"
"ESG
Eventi meteorologici
estremi","Rischi derivanti da eventi meteoro-
logici estremi e disastri naturali","Incidenti aerei, danni a persone, cose,
mezzi ed infrastrutture di ADR e di terzi","I. procedure, protocolli e piani
di emergenza nel rispetto dei
requisiti normativi e/o regolatori di
riferimento
II. attività di cooperazione e
coordinamento con gli Stakeholder
(es. enti locali e proprietari terrieri)"
"Cambiamenti
macro-economici
e socio-politici","Rischi derivanti dalle caratteristiche
e dinamiche macroeconomiche e
socio-politiche con ripercussioni
sui mercati in cui la Società opera
e connesse all’evoluzione del ciclo
economico, al panorama socio-
politico e/o macro-economico, a
cambiamenti di contesto rilevabili
nel medio-lungo periodo in
conseguenza al Macro Trend in atto","Effetti negativi di breve e lungo
periodo sulle performance economiche
del Gruppo (impatti derivanti
dall’andamento dell’inflazione, dal
conflitto Russia - Ucraina con maggiori
costi/ritardi per la realizzazione degli
investimenti e/o shortage di materiali
critici per le lavorazioni)","I. monitoraggio delle dinamiche ma-
croeconomiche e socio-politiche dei
mercati in cui l’organizzazione opera
II. monitoraggio e continuo aggior-
namento dello scenario analysis, va-
lutazione economica/finanziaria dei
diversi scenari ed individuazione delle
relative azioni da porre in essere (es.
azioni efficientamento/indipenden-
za energetica, strategie di acquisto
mirate per materiali critici etc.)"
