0,1,2,3
"ESG
Sicurezza del trasporto
aereo","Rischi per la sicurezza di persone e
mezzi nell’ambito delle operazioni
aeroportuali di terra/airside (es.
gestione emergenze pandemie,
terrorismo)","Incidenti aerei, danni a persone, cose,
mezzi ed infrastrutture di ADR e di terzi","I. organizzazione sistemi e procedure
di safety e security di cui a titolo
esemplificativo:
–
safety management system,
–
formazione del personale
–
Piani di emergenza aeropor-
tuale
–
monitoraggio del rispetto degli
standard di safety e security"
"ESG
Cybercrime","Rischi di perdita, furto, modifica,
divulgazione o accesso non autoriz-
zato ai dati dell’azienda","Indisponibilità dei sistemi con con-
seguente blocco delle operazioni
aeroportuali, perdita di dati sensibili o
confidenziali, frodi","I. strumenti e procedure di cyberse-
curity e piani di business continuity e
disaster recovery per i sistemi ICT"
"ESG
Business continuity","Rischi legati all’indisponibilità di
persone, infrastrutture e/o sistemi
(es. malfunzionamento di un impian-
to o sistema informatico critico)","Effetti sull’erogazione dei servizi e sulle
attività di business, con conseguente
compromissione del raggiungimento
degli obiettivi aziendali","I. pianificazione ed esecuzione delle
attività di manutenzione preventiva e
programmata su tutte le tipologie di
infrastrutture e impianti
II. presidio diretto sulla manutenzio-
ne degli impianti strategici
III. miglioramento continuo di siste-
mi, infrastrutture e procedure per
garantire la continuità delle opera-
zioni di scalo
IV. sistema delle relazioni industriali
e delle politiche sindacali
V. piani di business continuity e disa-
ster recovery per i sistemi ICT"
